id,original_language,original_title,overview,popularity,poster_path,release_date,title,vote_average,vote_count,genre
912649,en,Venom: The Last Dance,"Eddie et Venom sont en cavale. Chacun est traqué par ses semblables et alors que l'étau se resserre, le duo doit prendre une décision dévastatrice qui annonce la conclusion des aventures d'Eddie et de Venom.",12413.089,/uucVm4TBM07apHYoMwHnmvL5Mre.jpg,2024-10-22,Venom - The Last Dance,6.7,1214,"['Action', 'Science-Fiction', 'Aventure']"
1241982,en,Moana 2,"Vaiana 2 embarquera les spectateurs dans un périple inédit en compagnie de Vaiana, Maui et d’un improbable nouvel équipage de marins. Après avoir reçu un appel inattendu de ses ancêtres, la jeune femme entreprend un voyage qui la conduira jusqu’aux eaux dangereuses des confins des mers d’Océanie pour y vivre une aventure comme jamais vécue auparavant.",3983.756,/usdwoEwm68cdeMOvGFPwSk9nLTr.jpg,2024-11-21,Vaiana 2,6.8,432,"['Animation', 'Aventure', 'Familial', 'Comédie']"
1035048,en,Elevation,"Les survivants d’une invasion extra-terrestre mortelle par des créatures monstrueuses vivent une existence primitive dans les hauteurs des Montagnes Rocheuses postapocalyptiques. C’est le seul endroit où ils sont saufs, les monstres ne montent pas au-delà de 2500 mètres d’altitude pour une raison inexpliquée. Lorsqu’un père découvre qu’il ne reste que très peu des médicaments dont son fils a besoin, il doit quitter les montagnes et leur sécurité pour trouver un nouveau stock avant que son fils ne meure. Deux femmes courageuses l’accompagnent dans cette mission dangereuse en basse altitude.",2332.82,/uQhYBxOVFU6s9agD49FnGHwJqG5.jpg,2024-11-07,Elevation,6.421,127,"['Action', 'Science-Fiction', 'Thriller']"
974453,en,Absolution,"Ancien boxeur, Thug travaille depuis plus de trente ans comme homme de main pour un bandit de Boston et s'occupe notamment de la perception de dettes auprès de ses clients. Une consultation chez un médecin spécialiste lui révèle qu'il souffre d'encéphalopathie traumatique chronique. Se sentant impuissant devant sa mémoire qui décline, il cherche à reprendre contact avec ses enfants, dont sa fille Daisy, jeune mère de famille monoparentale, qui se montre réticente à renouer avec ce père absent.",1601.995,/heZRwC7AgsANwOGyyjBHkwmmc0P.jpg,2024-10-31,Absolution,6.0,121,"['Action', 'Crime', 'Thriller']"
1182387,en,Armor,Un père et son fils travaillent comme agents de sécurité pour une société de camions blindés. Ils rencontrent une équipe de voleurs sur un pont et se retrouvent piégés…,1374.715,/jmNBQ8GaQ4pzxPfZ4Lp1uJrcAE.jpg,2024-10-30,Armor,5.645,55,"['Action', 'Crime', 'Thriller']"
1299652,en,Watchmen: Chapter II,"Soupçonnant les événements qui ont piégé leurs anciens collègues, Nite Owl et Silk Spectre sont poussés à sortir de leur retraite pour enquêter. Alors qu'ils sont aux prises avec leur éthique personnelle, leurs démons intérieurs et une société qui se retourne contre eux, ils se démènent pour découvrir un complot qui pourrait déclencher une guerre nucléaire mondiale.",1231.205,/4rBObJFpiWJOG7aIlRrOUniAkBs.jpg,2024-11-25,Watchmen: Chapter II,7.7,45,"['Animation', 'Mystère', 'Science-Fiction', 'Action']"
957119,en,Sidelined: The QB and Me,,1150.68,/hklQwv6QVoOp5bWyh1bjuF2ydyG.jpg,2024-11-29,Sidelined: The QB and Me,6.6,60,"['Comédie', 'Romance', 'Téléfilm']"
1147416,fr,"Miraculous World : Londres, la course contre le temps","Afin de sauver l'avenir d'un terrible sort, Marinette devient Chronobug et fait équipe avec Bunnyx pour vaincre un mystérieux adversaire qui voyage dans le temps. Qui est ce nouveau super-méchant, et pourquoi est-il déterminé à dévoiler l'identité secrète de super-héros de Marinette ? Le seul espoir de Marinette est de vaincre son nouvel ennemi pour empêcher la fin de la Coccinelle et des temps !",1077.988,/imGI4R15rMl8B3wPROwkVuJDsc2.jpg,2024-11-14,"Miraculous World : Londres, la course contre le temps",8.6,36,"['Animation', 'Aventure', 'Action', 'Fantastique']"
558449,en,Gladiator II,"Des années après avoir assisté à la mort du héros vénéré Maximus aux mains de son oncle, Lucius est forcé d'entrer dans le Colisée lorsque son pays est conquis par les empereurs tyranniques qui gouvernent désormais Rome d'une main de fer. La rage au cœur et l'avenir de l'Empire en jeu, Lucius doit se tourner vers son passé pour trouver la force et l'honneur de rendre la gloire de Rome à son peuple.",1060.198,/rTa9otCuUwcJKoI78SkleDUC0pH.jpg,2024-11-05,Gladiator II,6.7,1019,"['Action', 'Aventure', 'Histoire']"
1184918,en,The Wild Robot,"After a shipwreck, an intelligent robot called Roz is stranded on an uninhabited island. To survive the harsh environment, Roz bonds with the island's animals and cares for an orphaned baby goose.",982.537,/wTnV3PCVW5O92JMrFvvrRcV39RU.jpg,2024-09-08,The Wild Robot,8.397,3376,"['Animation', 'Action', 'Science-Fiction', 'Familial']"
402431,en,Wicked,"Elphaba, une jeune femme incomprise à cause de la couleur inhabituelle de sa peau verte ne soupçonne même pas l'étendue de ses pouvoirs. À ses côtés, Glinda qui, aussi populaire que privilégiée, ne connaît pas encore la vraie nature de son cœur.",929.419,/aSPF68VOCvm3QqcYUkXGmKAfqzs.jpg,2024-11-20,Wicked,7.613,494,"['Drame', 'Romance', 'Fantastique']"
845781,en,Red One,"Après l'enlèvement du Père Noël, le chef de la sécurité du pôle Nord doit faire équipe avec le chasseur de primes le plus célèbre du monde dans une mission pleine d'action à travers le monde pour sauver Noël.",862.118,/4nYSXdxjBwzVZUv1X9YnTQ9ZEhM.jpg,2024-10-31,Red One,6.6,229,"['Action', 'Comédie', 'Fantastique']"
933260,en,The Substance,"Elisabeth Sparkle, vedette d’une émission d’aérobic, est licenciée le jour de ses 50 ans à cause de son âge. Le moral au plus bas, elle reçoit une proposition inattendue, celle d'un mystérieux laboratoire lui proposant une « substance » miraculeuse : si elle se l’injecte, elle deviendra la meilleure version d’elle-même, plus jeune, plus belle, plus parfaite grâce à une modification de son ADN...",852.731,/5Jfj6LqxOludXg454Vxef8dCJln.jpg,2024-09-07,The Substance,7.3,2500,"['Horreur', 'Science-Fiction']"
1100782,en,Smile 2,"Sur le point d’entamer une nouvelle tournée mondiale, la star planétaire de la pop, Skye Riley, commence à vivre des événements de plus en plus terrifiants et inexplicables. Dépassée par l’horreur croissante et la pression de la célébrité, Skye doit affronter son sombre passé pour reprendre le contrôle sur sa vie avant qu’elle n’en perde le contrôle.",817.616,/bZQweCDilXNvF8KuaEHcghM3Nwf.jpg,2024-10-16,Smile 2,6.589,896,"['Horreur', 'Mystère']"
1034541,en,Terrifier 3,"Après avoir survécu au massacre d'Halloween perpétré par Art Le Clown, Sienna et son frère tentent de reconstruire leur vie. Alors que les fêtes de fin d'année approchent, ils s'efforcent de laisser derrière eux les horreurs passées. Cependant, au moment où ils se croyaient enfin à l'abri, Art refait surface, bien décidé à transformer Noël en un véritable cauchemar.",797.477,/fM0B5Jej3jtLqo6J1zC41VipuTy.jpg,2024-10-09,Terrifier 3,6.9,1204,"['Horreur', 'Thriller']"
945961,en,Alien: Romulus,"Quelques années après les événements sur le vaisseau Nostromo, un groupe de jeunes colons de l'espace travaillent en tant que mineurs dans l'espoir de rejoindre une autre planète verdoyante, Yvaga. Un des membres propose d'utiliser une station spatiale abandonnée en orbite autour de leur planète actuelle afin de se rendre sur Yvaga. Cependant, ils se retrouvent face-à-face avec la forme de vie la plus terrifiante de l'univers alors qu'ils fouillent les profondeurs de cette station.",787.557,/xmDypImhT0OOloQIj3JLslUrBw8.jpg,2024-08-13,Alien : Romulus,7.2,2598,"['Horreur', 'Science-Fiction']"
1118031,es,Apocalipsis Z: el principio del fin,"Lorsqu'une sorte de rage qui transforme les gens en créatures agressives se répand sur la planète, Manel s'isole chez lui avec son chat, ne comptant que sur son intelligence pour survivre. Mais bientôt, ils doivent partir à la recherche de nourriture, par terre et par mer, en esquivant de nombreux dangers.",775.07,/yUsH05TXptcKbyYg485y5TQlUUz.jpg,2024-10-04,Apocalypse Z : le début de la fin,6.858,681,"['Drame', 'Action', 'Horreur']"
533535,en,Deadpool & Wolverine,"Un Wade Wilson désabusé s'abrutit de travail dans le civil. Sa vie de mercenaire moralement flexible, Deadpool, est derrière lui. Mais quand son monde est menacé d'anéantissement, il accepte à contrecœur de reprendre le flambeau, et de convaincre un Wolverine non moins contre-cœureux... contre-cordial ? Contre-cardiaque ? Il doit le convaincre de... ah, laisse tomber, va voir le film. Un synopsis, c'est débile. Mais entends l'avertissement : des flashs lumineux dans l'image pourraient affecter les spectateurs photosensibles.",743.706,/hw3Gfp8xLpoVewMbFyFVRsqyGlK.jpg,2024-07-24,Deadpool & Wolverine,7.7,5849,"['Action', 'Comédie', 'Science-Fiction']"
645757,en,That Christmas,"Les habitants de Wellington-on-Sea vont vivre un Noël inoubliable quand la pire tempête de neige de l'histoire bouleverse les plans de chacun, à commencer par ceux du père Noël.",659.76,/fyD7BNlJKcSdISDGUGNB3CsCE0q.jpg,2024-11-27,Ce Noël-là,7.592,76,"['Animation', 'Comédie', 'Familial', 'Fantastique', 'Aventure']"
791042,en,Levels,"Après avoir été témoin du meurtre de sa petite amie, Joe risque tout - y compris remettre la réalité elle-même en question - pour découvrir la vérité sur sa mort...",642.491,/y1xm0jMIlx9Oo2a3jWNyLGm43sJ.jpg,2024-11-01,Levels,5.803,38,"['Action', 'Science-Fiction', 'Thriller']"
1022789,en,Inside Out 2,"Riley, adolescente depuis peu, au moment où le Quartier Cérébral doit être démoli pour faire place à un événement totalement inattendu : de nouvelles Émotions ! Joie, Tristesse, Colère, Peur et Dégoût, qui ont longtemps su contrôler les choses avec succès, ne savent pas comment réagir à l'arrivée d'Anxiété. Et il semblerait qu'elle ne soit pas seule. Elle est venue accompagnée d'Embarras, Envie et Ennui.",632.136,/eHUWo4AiomQwG8EpWhvNNA1RMYz.jpg,2024-06-11,Vice-versa 2,7.574,4944,"['Animation', 'Aventure', 'Comédie', 'Drame', 'Familial']"
698687,en,Transformers One,"Les origines d'Optimus Prime et de Megatron, autrefois amis proches comme des frères, avant de devenir des ennemis jurés, façonnant ainsi à jamais le destin de Cybertron.",631.346,/92p2jvyqXiGv9VJyXgP5NJEzA92.jpg,2024-09-11,Transformers : Le Commencement,8.1,848,"['Animation', 'Science-Fiction', 'Aventure', 'Familial']"
1171640,fr,GTMAX,"Soélie, une jeune prodige de motocross, voit ses rêves de réussite brisés suite à un accident. Elle se consacre désormais à entraîner son frère, Michael. Quand celui-ci est recruté par des pilotes en scooter Tmax pour un braquage de haut vol à Paris, Soélie doit surmonter ses peurs pour le sauver.",626.414,/bx92hl70NUhojjO3eV6LqKllj4L.jpg,2024-11-19,GTMAX,6.1,70,"['Action', 'Crime', 'Drame']"
519182,en,Despicable Me 4,"Gru, Lucy et les filles, Margo, Édith et Agnès accueillent le petit dernier de la famille, Gru Junior, qui semble n’avoir qu’une passion : faire tourner son père en bourrique. Mais Gru est confronté à un nouvel ennemi, Maxime Le Mal, qui avec l’aide de sa petite amie, la fatale Valentina, va obliger toute la famille à fuir.",583.353,/bYovCvLV1RxB0zAR5cXu699P9P7.jpg,2024-06-20,"Moi, moche et méchant 4",7.077,2283,"['Animation', 'Familial', 'Comédie', 'Action']"
1326059,es,Pimpinero: Sangre y gasolina,"Dans le désert à la frontière entre la Colombie et le Venezuela, les ""pimpineros"" risquent leur vie, passant du carburant de contrebande d'un pays à l'autre. Lorsque Juan, un jeune trafiquant, est contraint de travailler pour un mystérieux rival, sa petite amie Diana entame un voyage périlleux afin de percer les secrets qui entourent ce no man's land.",540.266,/56W7fXQbRnL2fLjpEJLSLspaFnP.jpg,2024-10-10,Pimpinero : De Pétrole et de Sang,7.242,31,"['Action', 'Crime', 'Drame']"
995803,en,Arena Wars,,524.619,/4dRtXjk1rcsZlaMJpBn6Nh9cTfO.jpg,2024-06-25,Arena Wars,5.4,31,"['Action', 'Science-Fiction', 'Thriller', 'Comédie', 'Horreur']"
1154223,fr,Tigres et Hyènes,"De retour d’Espagne, Malik, jeune trafiquant, apprend que Serge, son beau-père, a été arrêté. Lors du procès, Iris, avocate de Chérif, un complice présumé, propose à Malik de réaliser un mystérieux coup pour faire évader son beau-père. Malik accepte et fait équipe avec les anciens partenaires de Chérif, des malfrats rangés, prêts à se réunir une dernière fois.",507.542,/80Fpd8a5BibX3kAD5lpZhCKqSyV.jpg,2024-11-22,Tigres et Hyènes,6.2,26,"['Action', 'Thriller']"
1124641,en,Classified,"Evan Shaw, tueur à gages de la CIA, reçoit ses ordres par les petites annonces des journaux afin de connaître sa prochaine cible. Lorsqu'il fait la rencontre de Kacey, une jeune analyste des services secrets britanniques, celle-ci lui annonce une nouvelle choquante : son contact à la CIA est mort depuis huit ans et la division est fermée depuis longtemps. Ensemble, ils vont tenter de découvrir pour qui il travaille réellement…",482.01,/4oQNuYThVdrVFdKWYwtI96LbA1O.jpg,2024-09-19,The Spy Code,5.8,93,"['Action', 'Thriller']"
592983,en,Spellbound,"Un puissant maléfice ayant transformé ses parents en monstres géants, une toute jeune princesse part en expédition en pleine nature pour conjurer le sort avant qu'il ne soit trop tard.",474.083,/9NUmEEFRNjHpbXdRrQBfKF7ZyzU.jpg,2024-11-22,Ellian et le sortilège,6.8,135,"['Animation', 'Fantastique', 'Familial', 'Aventure', 'Comédie']"
1010581,es,Culpa mía,"Noah doit quitter sa ville, son petit ami et ses amis pour emménager dans le manoir de William Leister, le nouveau et riche mari de sa mère. Âgée de dix-sept ans, fière et indépendante, Noah rencontre Nick, son nouveau demi-frère, et leurs fortes personnalités s’entrechoquent dès le début. Noah découvre bientôt que derrière l'image d'un fils modèle, Nick cache une vie de bagarre, de jeu et de courses automobiles illégales. Malgré l'abîme qui les sépare, tous deux commencent à ressentir une attirance irrésistible qui se transformera bientôt en feu et en folle passion. Ni la rivalité permanente, ni l'opposition de leur entourage ne peuvent les empêcher de tomber secrètement et follement amoureux. Mais le présent turbulent de Nick et le passé orageux de Noah mettront à l'épreuve leur vie et leur amour interdit.",465.077,/3ZCfSSxZ2e4Kiwu3Y9dvfT5n1m6.jpg,2023-06-08,À contre-sens,7.917,3095,"['Romance', 'Drame']"
1097870,en,Dear Santa,"Le sympathique Liam, élève de 6e, écrit au Père Noël pour lui demander de prouver qu'il existe bel et bien. Mais Liam est dyslexique et envoie accidentellement sa lettre à Satan, qui se présente chez Liam, tout excité de recevoir sa première lettre de fanboy et désireux d'avoir un peu de l'âme de Liam.",439.807,/7cwmd4okqfLT8h0QBanuBnD3HJ7.jpg,2024-11-24,Dear Santa,6.655,113,"['Comédie', 'Fantastique', 'Horreur']"
1106739,en,Juror #2,"Justin Kemp, un père de famille, qui est juré d’un procès très médiatisé pour meurtre. Il se retrouve alors aux prises avec un grave dilemme moral... Il a le pouvoir d’influencer le verdict du jury, qui pourrait décider de condamner ou de libérer l’assassin présumé.",421.099,/ttQ4ooQ5mzFLhlAtDUqvBDBXyQ5.jpg,2024-10-30,Juré n°2,7.0,588,"['Crime', 'Drame']"
1051896,en,Arcadian,"Dans un futur proche, Paul et ses deux fils, Thomas et Joseph, luttent pour survivre dans un monde où, chaque nuit, des créatures féroces rôdent. Un soir, Thomas ne rentre pas avant le coucher du soleil. Paul part alors à sa recherche mais se blesse gravement au cours d'un combat acharné contre un monstre. Désormais, les frères vont devoir survivre, livrés à eux-même.",417.317,/spWV1eRzlDxvai8LbxwAWR0Vst4.jpg,2024-04-12,Arcadian,6.127,481,"['Action', 'Horreur', 'Thriller', 'Science-Fiction']"
1196470,fr,Survivre,"Une catastrophe bouleverse la planète : les pôles magnétiques de la Terre se sont inversés. Les océans ont anéanti les continents, laissant derrière eux un vaste désert. Dans ce monde ravagé, une famille doit lutter pour sa survie. Quand les pôles s’inverseront à nouveau, il sera trop tard.",412.992,/901kRttzfLScns7ss7RyKqG6d2A.jpg,2024-06-19,Survivre,5.9,72,"['Thriller', 'Aventure', 'Action', 'Science-Fiction']"
1165466,en,Wake Up,"Un groupe d'adolescents activistes s'introduit dans un magasin de meubles pour filmer des actions de boycott et dénoncer les pratiques « écocides » de l'entreprise. L'agent de sécurité est un déséquilibré, obnubilé par la chasse « primitive ». La situation dégénère, une véritable chasse à l'homme commence.",405.017,/kNcUH0rfdBKTBCvdFxGvuBInU4O.jpg,2024-05-08,Wake Up,7.4,70,"['Horreur', 'Thriller', 'Action']"
1167271,en,Weekend in Taipei,"John Lawlor est un redoutable agent de la DEA pour qui le travail passe avant tout. De l’autre côté du globe, Joey Kwang vit sa vie pied au plancher. Au volant, il n’y a pas meilleur pilote qu’elle. Ils se sont rencontrés à Taipei. Leur histoire a été folle, brulante, passionnée. Mais de courte durée… Quinze ans plus tard, le destin les réunit de nouveau à Taipei. Les émotions enfouies refont surface. Dans un monde où le danger rôde à chaque coin de rue, seule la passion qui les avait unis autrefois pourra les sauver…",403.078,/g6QiIe8pRKpofJF6TyCXHQde7GC.jpg,2024-09-19,Week-end à Taipei,6.1,59,"['Action', 'Aventure', 'Thriller']"
1029235,en,Azrael,"Dans un monde où personne ne parle. Une communauté dévote traque une jeune femme, Azrael, qui s'est échappée de son emprisonnement. Recapturée, elle doit être sacrifiée pour lutter contre un esprit malveillant.",388.169,/qpdFKDvJS7oLKTcBLXOaMwUESbs.jpg,2024-09-27,Azrael,6.0,144,"['Action', 'Horreur', 'Thriller']"
1100099,en,We Live in Time,"Un chef prometteur et une jeune divorcée voient leur vie changée à jamais lorsqu'une rencontre fortuite les réunit, dans une histoire d'amour profondément émouvante qui s'étend sur une décennie.",384.421,/ldMZ3sg5kF3KsmIxZ4T6zw7SXOa.jpg,2024-10-10,L'Amour au présent,7.587,195,"['Romance', 'Drame']"
335983,en,Venom,"Des symbiotes débarquent sur la Terre, parmi eux, Venom, qui va s’allier avec Eddie Brock. De son côté, un puissant scientifique tente de faire évoluer l’humanité avec les symbiotes, le duo d’anti‐héros va devoir tout faire pour l’arrêter !",378.783,/vVusHIRlyyFVS42XnqZso2wGKr.jpg,2018-09-28,Venom,6.834,16071,"['Science-Fiction', 'Action']"
580489,en,Venom: Let There Be Carnage,"Environ un an après avoir affronté Riot, Eddie Brock « cohabite » toujours avec le symbiote Venom. Alors qu’il tente de relancer sa carrière de journaliste d'investigation, Eddie se rend en prison pour interviewer le tueur en série Cletus Kasady. Il ignore que ce dernier est lui aussi l'hôte d'un symbiote, Carnage.",371.93,/tueBy90QPdzuY0SYjP9sBiM3qNS.jpg,2021-09-30,Venom : Let There Be Carnage,6.8,10271,"['Science-Fiction', 'Action', 'Aventure']"
1064028,en,Subservience,"Un père à bout de souffle se procure un robot humanoïde domestique pour l'aider à s'occuper de sa maison et de sa famille, ignorant qu’elle évoluera jusqu’à développer sa propre conscience et devenir mortelle.",370.908,/hJamqr7LTMxWjCzMMYtbQySJxAm.jpg,2024-08-15,Subservience,6.723,366,"['Science-Fiction', 'Thriller', 'Horreur']"
1084736,fr,Le Comte de Monte-Cristo,"Victime d’un complot, le jeune Edmond Dantès est arrêté le jour de son mariage pour un crime qu’il n’a pas commis. Après quatorze ans de détention au château d’If, il parvient à s’évader. Devenu immensément riche, il revient sous l’identité du comte de Monte-Cristo pour se venger des trois hommes qui l’ont trahi.",360.713,/bHd2ry2KYR109dl87agYQ2nCsnR.jpg,2024-06-28,Le Comte de Monte-Cristo,8.193,955,"['Action', 'Aventure', 'Drame', 'Histoire', 'Romance', 'Thriller']"
1331375,en,Dominique,"Une tueuse aguerrie fuit son passé troublé pour commencer une nouvelle vie, mais se retrouve dans une ville violente. Elle doit décider si elle doit se protéger elle-même ou la famille qui l'a accueillie.",352.277,/jvug7Esd89yNLJwGvUfeQ9j69cE.jpg,2024-10-11,Dominique,7.563,72,"['Action', 'Thriller']"
482600,ko,일본 엄마,,344.802,/hq1EaYIqUNrPM3QFYAbnH2UHoX8.jpg,2017-02-09,일본 엄마,6.2,28,"['Romance', 'Drame']"
1014505,ja,劇場版「オーバーロード」聖王国編,"Jaldabaoth décide d'envahir le Saint Royaume de Roble avec les demi-humains. Conscient de la menace, le Saint Royaume prévoit de faire appel à Momon pour l'aider dans cette guerre.  (Pour rappel, ce film fera suite à la quatrième saison)",337.039,/fggkIB6oeVi5Mpwl0fALLVevAFN.jpg,2024-09-20,Overlord : The Sacred Kingdom,7.9,22,"['Action', 'Aventure', 'Animation', 'Fantastique']"
573435,en,Bad Boys: Ride or Die,"Le détective de Miami Mike Lowrey apprend que son ex-supérieur à l'escouade anti-drogue, le défunt capitaine Howard, aurait reçu des centaines de millions de dollars de la part des cartels mexicains. Avec son coéquipier et ami Marcus Burnett, Mike entreprend de blanchir la réputation de Howard. Or, le meurtrier du capitaine, le trafiquant Armando Aretas, est le seul à pouvoir identifier le véritable traître au sein des forces de police de Miami. Et puisque le repenti Armando est également le fils de Mike, ce dernier obtient qu'il soit temporairement libéré de prison pour participer à l'enquête. Mais ce faisant, Marcus, Mike et son fils se retrouvent à leur tour compromis par le chef des conspirateurs, qui lance des chasseurs de primes à leurs trousses.",336.901,/rHRErXpF2AIhw6i4GD1ikqy8uak.jpg,2024-06-05,Bad Boys: Ride or Die,7.485,2421,"['Action', 'Comédie']"
8871,en,How the Grinch Stole Christmas,"Le Grinch est un croque-mitaine de poils verts qui arbore un sourire élastique jusqu'aux oreilles. Misanthrope exilé, il vit depuis 53 ans dans une grotte sur le mont Crumpit avec son chien Max. Il se nourrit de jus de laitue, d'huile de castor et de lait tourné, et a un cœur trois fois trop petit pour aimer qui que ce soit. Recueilli par deux charmantes vieilles dames, le Grinch aurait aimé avoir une enfance et une scolarité normales, avoir des copains et flirter avec la gentille Martha qui le couvait d'un œil tendre. Mais les petits Whos se comportèrent si cruellement avec lui qu'ils le contraignirent à l'exil.",321.348,/cmbQRAux3YdOIIk9RIj1Hq3C05f.jpg,2000-11-17,Le Grinch,6.765,7424,"['Familial', 'Comédie', 'Fantastique']"
957452,en,The Crow,"La veille de leur mariage, Eric Draven et Shelly Webster sont sauvagement assassinés. Un an plus tard, un corbeau ramène Eric à la vie au coeur d'une ville plongée dans les ténèbres. Eric va se laisser conduire là où sa vengeance l'appelle. Pour que justice soit faite. Pour l'amour de Shelly.",318.005,/gEeLJ1F8SnLZk6q8PEAZ3qjWVdP.jpg,2024-08-21,The Crow,5.9,794,"['Action', 'Fantastique', 'Horreur']"
1116490,en,Cash Out,"Mason est un génie du crime qui monte des braquages complexes qui rapportent gros. Quand son petit frère décide de monter seul un braquage pour récupérer un mystérieux coffre, la situation dérape et Mason est obligé d'intervenir. La situation prend une dimension inattendue quand plusieurs pays se font concurrence pour mettre la main sur le coffre et qu'Interpol se jette à leur trousse.",317.236,/xBJnIvRdL0nDHgvivr6EgBQizes.jpg,2024-04-26,Cash Out,6.3,137,"['Action', 'Thriller']"
823219,lv,Straume,"A solitary cat, displaced by a great flood, finds refuge on a boat with various species and must navigate the challenges of adapting to a transformed world together.",312.637,/enRimDhtFfb7hNTQlOjrgK8O8UO.jpg,2024-08-29,Flow,8.5,365,"['Animation', 'Fantastique', 'Aventure']"
360920,en,The Grinch,"Terré dans sa cave remplie d’inventions et d’engins pour ses besoins de tous les jours, Le Grinch ne voit ses voisins de Chouville que lorsqu’il manque de nourriture. Chaque année à Noël, ils viennent perturber sa tranquillité solitaire avec des célébrations toujours plus grandioses, brillantes et bruyantes. Quand les Chous déclarent qu’ils vont célébrer Noël trois fois plus fort cette année, le Grinch réalise qu’il n’a plus qu’une solution pour retrouver la paix et la tranquillité : il doit voler Noël.",308.877,/36a2GG5L0QW7iP2g8OCYoAW9PJ.jpg,2018-11-08,Le Grinch,6.865,3947,"['Animation', 'Familial', 'Comédie', 'Fantastique']"
1084863,fr,Le Mangeur d'âmes,"La commandante Élisabeth Guardiano est chargée d'aller enquêter sur un double meurtre d'une rare brutalité dans une petite commune des Vosges. Sur place, elle rencontre le capitaine de gendarmerie Franck de Rolan qui fait face à une série de disparitions d’enfants. Impuissants face à un village hostile, ils vont être contraints d’unir leurs forces pour découvrir la vérité, une vérité terrifiante empreinte de légendes occultes...",307.261,/m0HSecww9Tm79pbiXAE9zqLqq9T.jpg,2024-04-24,Le Mangeur d'âmes,6.2,85,"['Thriller', 'Horreur', 'Crime', 'Mystère']"
772,en,Home Alone 2: Lost in New York,"Après Paris, c'est à Miami que la tribu McCallister décide de passer les fêtes de Noël. À l'aube du jour J, toute la famille est sur le pied de guerre et file a l'aéroport en prenant bien garde de ne pas oublier Kevin. Mais celui-ci s'éclipse pour acheter des piles pour son walkman, il ne retrouve plus les siens et s'embarque par mégarde pour New York...",303.848,/gFhf8NwvEKCbNIOQZxLqj1i5DMy.jpg,1992-11-15,"Maman, j'ai encore raté l'avion !",6.7,9563,"['Comédie', 'Familial', 'Aventure']"
